{
  "packageKind": "grounding-model",
  "runtimeId": "grounding-model-gui-actor-2b-fp16",
  "version": "0.1.0",
  "upstream": {
    "modelId": "microsoft/GUI-Actor-2B-Qwen2-VL",
    "revision": "pending-phase0-pin",
    "licence": "mit",
    "baseModel": {
      "modelId": "Qwen/Qwen2-VL-2B-Instruct",
      "licence": "apache-2.0"
    }
  },
  "identity": {
    "groundingContractVersion": 1,
    "adapterId": "gui-actor-onnx",
    "architecture": "gui-actor-2b-qwen2-vl",
    "manifestVersion": 1,
    "preprocessingRevision": "prep-v1",
    "decodingRevision": "dec-v1",
    "calibrationRevision": "cal-v1"
  },
  "export": {
    "pipelineVersion": "export-v1",
    "exporter": "torch-onnx 2.6",
    "opset": 17,
    "quantization": "fp16"
  },
  "preprocessing": {
    "patchSize": 14,
    "mergeSize": 2,
    "temporalPatchSize": 2,
    "pointerPadTokenId": 151661,
    "pixelBounds": {
      "minWidthPx": 224,
      "maxWidthPx": 3584,
      "minHeightPx": 224,
      "maxHeightPx": 3584
    },
    "defaultPixelBudget": 1500000
  },
  "graphs": [
    {
      "name": "vision_encoder.onnx",
      "inputs": [
        "pixel_values",
        "image_grid_thw"
      ],
      "outputs": [
        "image_embeds"
      ]
    },
    {
      "name": "decoder_prefill.onnx",
      "inputs": [
        "input_embeds",
        "position_ids"
      ],
      "outputs": [
        "image_pad_hidden",
        "pointer_pad_hidden"
      ]
    },
    {
      "name": "pointer_head.onnx",
      "inputs": [
        "image_pad_hidden",
        "pointer_pad_hidden"
      ],
      "outputs": [
        "attention_scores"
      ]
    }
  ],
  "executionProviders": [
    "dml",
    "cpu"
  ],
  "files": [
    {
      "path": "vision_encoder.onnx",
      "bytes": 1024,
      "sha256": "1111111111111111111111111111111111111111111111111111111111111111"
    },
    {
      "path": "vision_encoder.data.000",
      "bytes": 536870912,
      "sha256": "2222222222222222222222222222222222222222222222222222222222222222"
    },
    {
      "path": "decoder_prefill.onnx",
      "bytes": 2048,
      "sha256": "3333333333333333333333333333333333333333333333333333333333333333"
    },
    {
      "path": "pointer_head.onnx",
      "bytes": 512,
      "sha256": "4444444444444444444444444444444444444444444444444444444444444444"
    },
    {
      "path": "tokenizer.json",
      "bytes": 1024,
      "sha256": "5555555555555555555555555555555555555555555555555555555555555555"
    },
    {
      "path": "health/fixture.png",
      "bytes": 256,
      "sha256": "6666666666666666666666666666666666666666666666666666666666666666"
    }
  ],
  "licences": [
    {
      "component": "GUI-Actor weights",
      "licence": "mit",
      "noticePath": "LICENSES/GUI-ACTOR"
    },
    {
      "component": "Qwen2-VL-2B base",
      "licence": "apache-2.0",
      "noticePath": "LICENSES/QWEN2-VL"
    }
  ],
  "parityReport": {
    "sha256": "7777777777777777777777777777777777777777777777777777777777777777",
    "fixtureCount": 12,
    "status": "candidate"
  },
  "healthFixture": {
    "imagePath": "health/fixture.png",
    "expectedPath": "health/expected.json"
  },
  "limits": {
    "maxFiles": 128,
    "maxTotalBytes": 8589934592,
    "maxShardBytes": 536870912
  }
}
