{
  "packageKind": "grounding-model",
  "runtimeId": "grounding-model-gui-actor-2b-fp16",
  "version": "0.1.0",
  "upstream": {
    "modelId": "microsoft/GUI-Actor-2B-Qwen2-VL",
    "revision": "r1",
    "licence": "mit",
    "baseModel": {
      "modelId": "Qwen/Qwen2-VL-2B-Instruct",
      "licence": "qwen-research-non-commercial"
    }
  },
  "identity": {
    "groundingContractVersion": 1,
    "adapterId": "gui-actor-onnx",
    "architecture": "gui-actor-2b-qwen2-vl",
    "manifestVersion": 1,
    "preprocessingRevision": "prep-v1",
    "decodingRevision": "dec-v1",
    "calibrationRevision": "cal-v1"
  },
  "export": {
    "pipelineVersion": "export-v1",
    "exporter": "torch-onnx 2.6",
    "opset": 17,
    "quantization": "fp16"
  },
  "preprocessing": {
    "patchSize": 14,
    "mergeSize": 2,
    "temporalPatchSize": 2,
    "pointerPadTokenId": 151661,
    "pixelBounds": {
      "minWidthPx": 224,
      "maxWidthPx": 3584,
      "minHeightPx": 224,
      "maxHeightPx": 3584
    },
    "defaultPixelBudget": 1500000
  },
  "graphs": [
    {
      "name": "pointer_head.onnx",
      "inputs": [
        "i"
      ],
      "outputs": [
        "o"
      ]
    }
  ],
  "executionProviders": [
    "dml",
    "cpu"
  ],
  "files": [
    {
      "path": "pointer_head.onnx",
      "bytes": 512,
      "sha256": "9ea2ca99172f8143d19673eb288cb607ce2e87f09914569ac1285981dcb8803c"
    },
    {
      "path": "health/fixture.png",
      "bytes": 11,
      "sha256": "a955478a5063e939bdc3936ef8a0674ae86d0cd2d27d32200c6e4db9cebfdc9f"
    },
    {
      "path": "health/expected.json",
      "bytes": 20,
      "sha256": "c75d9bf173cb320524d9cc28ca0c63dc351009cd8a3613802a2183c4b651f71d"
    }
  ],
  "licences": [
    {
      "component": "GUI-Actor weights",
      "licence": "mit",
      "noticePath": "LICENSES/GUI-ACTOR"
    },
    {
      "component": "Qwen2-VL base",
      "licence": "apache-2.0",
      "noticePath": "LICENSES/QWEN2-VL"
    }
  ],
  "parityReport": {
    "sha256": "7777777777777777777777777777777777777777777777777777777777777777",
    "fixtureCount": 12,
    "status": "passed"
  },
  "healthFixture": {
    "imagePath": "health/fixture.png",
    "expectedPath": "health/expected.json"
  },
  "limits": {
    "maxFiles": 128,
    "maxTotalBytes": 8589934592,
    "maxShardBytes": 536870912
  }
}